<?xml version="1.0" encoding="UTF-8"?>
<suppressions xmlns="https://jeremylong.github.io/DependencyCheck/dependency-suppression.1.4.xsd"
              xmlns:xsi="http://www.w3.org/2001/XMLSchema-instance"
              xsi:schemaLocation="https://jeremylong.github.io/DependencyCheck/dependency-suppression.1.4.xsd
                                  https://dependency-check.github.io/DependencyCheck/dependency-suppression.1.4.xsd">
    <suppress>
        <notes><![CDATA[
        file name: commons-fileupload-1.2.1.jar
        ]]></notes>
        <sha1>384FAA82E193D4E4B0546059CA09572654BC3970</sha1>
        <cpe>cpe:/a:apache:commons_fileupload:1.2.1</cpe>
    </suppress>
    <suppress>
        <notes><![CDATA[
        file name: commons-fileupload-1.2.1.jar
        ]]></notes>
        <sha1>384FAA82E193D4E4B0546059CA09572654BC3970</sha1>
        <cve>CVE-2014-0050</cve>
    </suppress>
</suppressions>